{
  "building": {
    "building_id": "fixture-office",
    "name": "F1 fixture office",
    "timezone": "Asia/Kolkata"
  },
  "created_note": "Hand-authored F1 known-answer fixture. Not measured data.",
  "devices": [
    {
      "always_on": false,
      "control": "scheduled",
      "controls": [
        "switch"
      ],
      "device_id": "light-a",
      "device_type": "lighting",
      "name": "Room A light",
      "nominal_power_w": 600,
      "power_factor": 1.0,
      "quantity": 1,
      "room_id": "room-a",
      "standby_power_w": 0
    },
    {
      "always_on": true,
      "control": "always_on",
      "controls": [],
      "device_id": "fridge-b",
      "device_type": "refrigerator",
      "name": "Room B refrigerator",
      "nominal_power_w": 300,
      "power_factor": 1,
      "quantity": 1,
      "room_id": "room-b",
      "standby_power_w": 0
    }
  ],
  "device_intervals": [
    {
      "avg_current_a": 3.0,
      "avg_power_w": 600,
      "avg_voltage_v": 200,
      "cumulative_kwh": 0.01,
      "device_id": "light-a",
      "energy_kwh": 0.01,
      "interval_end_utc": "2026-09-21T03:31:00Z",
      "interval_seconds": 60,
      "interval_start_utc": "2026-09-21T03:30:00Z",
      "max_power_w": 600,
      "offschedule_on_seconds": 0,
      "on_fraction": 1,
      "override_seconds": 0,
      "partial": false,
      "policy_ref": "pol-light-a:1",
      "power_factor": 1.0,
      "room_id": "room-a",
      "run_id": "run-fixture-001",
      "vacant_on_seconds": 0
    },
    {
      "avg_current_a": 3.0,
      "avg_power_w": 600,
      "avg_voltage_v": 200,
      "cumulative_kwh": 0.02,
      "device_id": "light-a",
      "energy_kwh": 0.01,
      "interval_end_utc": "2026-09-21T03:32:00Z",
      "interval_seconds": 60,
      "interval_start_utc": "2026-09-21T03:31:00Z",
      "max_power_w": 600,
      "offschedule_on_seconds": 0,
      "on_fraction": 1,
      "override_seconds": 0,
      "partial": false,
      "policy_ref": "pol-light-a:1",
      "power_factor": 1.0,
      "room_id": "room-a",
      "run_id": "run-fixture-001",
      "vacant_on_seconds": 60
    },
    {
      "avg_current_a": 1.5,
      "avg_power_w": 300,
      "avg_voltage_v": 200,
      "cumulative_kwh": 0.005,
      "device_id": "fridge-b",
      "energy_kwh": 0.005,
      "interval_end_utc": "2026-09-21T03:31:00Z",
      "interval_seconds": 60,
      "interval_start_utc": "2026-09-21T03:30:00Z",
      "max_power_w": 300,
      "offschedule_on_seconds": 0,
      "on_fraction": 1,
      "override_seconds": 0,
      "partial": false,
      "policy_ref": "pol-fridge-b:1",
      "power_factor": 1,
      "room_id": "room-b",
      "run_id": "run-fixture-001",
      "vacant_on_seconds": 60
    },
    {
      "avg_current_a": 1.5,
      "avg_power_w": 300,
      "avg_voltage_v": 200,
      "cumulative_kwh": 0.01,
      "device_id": "fridge-b",
      "energy_kwh": 0.005,
      "interval_end_utc": "2026-09-21T03:32:00Z",
      "interval_seconds": 60,
      "interval_start_utc": "2026-09-21T03:31:00Z",
      "max_power_w": 300,
      "offschedule_on_seconds": 0,
      "on_fraction": 1,
      "override_seconds": 0,
      "partial": false,
      "policy_ref": "pol-fridge-b:1",
      "power_factor": 1,
      "room_id": "room-b",
      "run_id": "run-fixture-001",
      "vacant_on_seconds": 60
    }
  ],
  "export": {
    "created_utc": "2026-09-21T03:32:00Z",
    "export_end_utc": "2026-09-21T03:32:00Z",
    "export_id": "export-fixture-001",
    "export_start_utc": "2026-09-21T03:30:00Z",
    "interval_seconds": 60
  },
  "policies": [
    {
      "applies_to": "building:fixture-office",
      "effective_from_utc": "2026-09-21T03:30:00Z",
      "kind": "office_hours",
      "policy_id": "pol-hours",
      "rules": {
        "close_local": "18:00",
        "open_local": "09:00",
        "overnight": false,
        "working_days_iso": [
          1,
          2,
          3,
          4,
          5
        ]
      },
      "version": 1
    },
    {
      "applies_to": "device:light-a",
      "effective_from_utc": "2026-09-21T03:30:00Z",
      "kind": "lighting_schedule",
      "policy_id": "pol-light-a",
      "rules": {
        "on_during_hours": true,
        "vacancy_grace_seconds": 0
      },
      "version": 1
    },
    {
      "applies_to": "device:fridge-b",
      "effective_from_utc": "2026-09-21T03:30:00Z",
      "kind": "always_on",
      "policy_id": "pol-fridge-b",
      "rules": {
        "always_on_exception": true
      },
      "version": 1
    }
  ],
  "room_intervals": [
    {
      "avg_rh_pct": 55,
      "avg_temp_c": 27.5,
      "interval_end_utc": "2026-09-21T03:31:00Z",
      "interval_seconds": 60,
      "interval_start_utc": "2026-09-21T03:30:00Z",
      "occupancy_avg": 1,
      "occupancy_max": 1,
      "occupied_fraction": 1,
      "partial": false,
      "room_id": "room-a",
      "run_id": "run-fixture-001"
    },
    {
      "avg_rh_pct": 55,
      "avg_temp_c": 27.6,
      "interval_end_utc": "2026-09-21T03:32:00Z",
      "interval_seconds": 60,
      "interval_start_utc": "2026-09-21T03:31:00Z",
      "occupancy_avg": 0,
      "occupancy_max": 0,
      "occupied_fraction": 0,
      "partial": false,
      "room_id": "room-a",
      "run_id": "run-fixture-001"
    },
    {
      "avg_rh_pct": 60,
      "avg_temp_c": 24.5,
      "interval_end_utc": "2026-09-21T03:31:00Z",
      "interval_seconds": 60,
      "interval_start_utc": "2026-09-21T03:30:00Z",
      "occupancy_avg": 0,
      "occupancy_max": 0,
      "occupied_fraction": 0,
      "partial": false,
      "room_id": "room-b",
      "run_id": "run-fixture-001"
    },
    {
      "avg_rh_pct": 60,
      "avg_temp_c": 24.5,
      "interval_end_utc": "2026-09-21T03:32:00Z",
      "interval_seconds": 60,
      "interval_start_utc": "2026-09-21T03:31:00Z",
      "occupancy_avg": 0,
      "occupancy_max": 0,
      "occupied_fraction": 0,
      "partial": false,
      "room_id": "room-b",
      "run_id": "run-fixture-001"
    }
  ],
  "rooms": [
    {
      "capacity": 4,
      "floor_area_m2": 20,
      "name": "Room A",
      "room_id": "room-a",
      "room_type": "office"
    },
    {
      "capacity": 2,
      "floor_area_m2": 12,
      "name": "Room B",
      "room_id": "room-b",
      "room_type": "utility"
    }
  ],
  "run": {
    "comparison_id": null,
    "run_id": "run-fixture-001",
    "run_start_utc": "2026-09-21T03:30:00Z",
    "scenario_id": "original"
  },
  "schema_version": "1.0.1",
  "source": "simulation",
  "synthetic": true,
  "synthetic_label": "F1 known-answer fixture: hand-computed two-room/two-device dataset. Not measured data."
}
